{"arch":"llama","compatible_soc":["op15"],"dtype":"f16","graph_hash":"sha256:509011f0abd4afd03e5d93e64982bab33549c5bbe43773feddb78356384e2869","layout_version":1,"model_id":"plain-7b-f16","model_version":"sha256:aaed9a9f508088eba7b56d3fbe7ef875b6085d30a21004da8e946bd4f9244935","n_layer_total":32,"partial_load_supported":false,"required_backends":[{"backend":"htp","backend_build":"sha256:3b3e2d0bd135247c949fd5cc4615b479e3978b2ebbd88af2bd7de3406e762cfa"}],"resident_ram_estimate_bytes":null,"schema_version":1,"source_sha256":"sha256:ccad120c1dc92a1c94ca150baef7fe3d1b110c9c13b95afa0e3be02c34972ca1","warmup_cmd":"","weight_sets":[{"layer_range":{"end":32,"n_layer_total":32,"start":0},"set_digest":"sha256:6027cdab3eb96cae970d3851b838f857c963da77060b9205a101c9b70ef0c58b","total_bytes":9000,"weight_set_id":"ws-full"}]}
